{
  "contract_version": "2.5.0",
  "base_delta": "contracts/v2.4/fixtures/valid/capability-readiness-delta.json",
  "product_denominator": 143,
  "slice_denominator": {"intake": 17, "project_understanding": 12, "total": 29},
  "capabilities": [
    {"capability_id":"intake.recursive-folder-admission","prior":"CONTRACT_ONLY","current":"PARTIAL","evidence":["browser.folder-relative-path-intake"],"remaining_gaps":["cross-browser directory admission is not production-qualified"]},
    {"capability_id":"intake.batch-upload","prior":"CAPABILITY_READY","current":"CAPABILITY_READY","evidence":["postgres.browser-batch-manifest"],"remaining_gaps":[]},
    {"capability_id":"intake.streamed-hashing","prior":"CAPABILITY_READY","current":"CAPABILITY_READY","evidence":["postgres.streamed-sha256-receipt"],"remaining_gaps":[]},
    {"capability_id":"intake.mime-content-validation","prior":"CAPABILITY_READY","current":"CAPABILITY_READY","evidence":["unit.magic-signature-validation"],"remaining_gaps":[]},
    {"capability_id":"intake.deduplication","prior":"CAPABILITY_READY","current":"CAPABILITY_READY","evidence":["postgres.idempotent-intake-manifest"],"remaining_gaps":[]},
    {"capability_id":"intake.archive-handling","prior":"CONTRACT_ONLY","current":"PARTIAL","evidence":["postgres.safe-zip-member-lineage"],"remaining_gaps":["only ZIP is supported"]},
    {"capability_id":"intake.pdf-page-inventory","prior":"CAPABILITY_READY","current":"CAPABILITY_READY","evidence":["postgres.page-terminal-outcomes"],"remaining_gaps":[]},
    {"capability_id":"intake.native-extraction","prior":"PARTIAL","current":"PARTIAL","evidence":["semantic-e2e.pdf-docx-xlsx-csv-native"],"remaining_gaps":["CAD and specialized estimate formats remain unsupported"]},
    {"capability_id":"intake.ocr","prior":"CONTRACT_ONLY","current":"PARTIAL","evidence":["representative-corpus.page-routing"],"remaining_gaps":["OCR profiles are not qualified across the industrial format denominator"]},
    {"capability_id":"intake.vlm-routing","prior":"FOUNDATION_ONLY","current":"FOUNDATION_ONLY","evidence":["candidate-only-routing-contract"],"remaining_gaps":["no general industrial VLM qualification"]},
    {"capability_id":"intake.sharding","prior":"FOUNDATION_ONLY","current":"FOUNDATION_ONLY","evidence":["page-region-lineage-contract"],"remaining_gaps":["region sharding is not scale-qualified"]},
    {"capability_id":"intake.backpressure","prior":"CONTRACT_ONLY","current":"PARTIAL","evidence":["scale.admission-queue-baseline"],"remaining_gaps":["product thresholds are not owner-approved"]},
    {"capability_id":"intake.crash-recovery","prior":"CAPABILITY_READY","current":"CAPABILITY_READY","evidence":["postgres.worker-lease-recovery"],"remaining_gaps":[]},
    {"capability_id":"intake.quarantine","prior":"FOUNDATION_ONLY","current":"PARTIAL","evidence":["postgres.typed-corrupt-document-quarantine"],"remaining_gaps":["quarantine release governance is not complete"]},
    {"capability_id":"intake.scale-1k","prior":"PARTIAL","current":"PARTIAL","evidence":["scale.receipt-1k"],"remaining_gaps":["measured baseline only; threshold is unset"]},
    {"capability_id":"intake.scale-5k","prior":"PARTIAL","current":"PARTIAL","evidence":["scale.receipt-5k"],"remaining_gaps":["measured baseline only; threshold is unset"]},
    {"capability_id":"intake.scale-10k","prior":"PARTIAL","current":"PARTIAL","evidence":["scale.receipt-10k"],"remaining_gaps":["measured baseline only; threshold is unset"]},
    {"capability_id":"project-understanding.pz-identification","prior":"CONTRACT_ONLY","current":"PARTIAL","evidence":["semantic-e2e.explanatory-note-classification"],"remaining_gaps":["representative synthetic corpus only"]},
    {"capability_id":"project-understanding.pd-rd-classification","prior":"CONTRACT_ONLY","current":"PARTIAL","evidence":["semantic-e2e.page-role-decisions"],"remaining_gaps":["drawing classification remains partial"]},
    {"capability_id":"project-understanding.oks-structure","prior":"CONTRACT_ONLY","current":"PARTIAL","evidence":["semantic-e2e.project-definition-structure"],"remaining_gaps":["real OKS denominator is not accepted"]},
    {"capability_id":"project-understanding.spatial-structure","prior":"CONTRACT_ONLY","current":"PARTIAL","evidence":["semantic-e2e.zones-levels-fronts"],"remaining_gaps":["confirmed geometry remains a gap"]},
    {"capability_id":"project-understanding.work-types","prior":"CONTRACT_ONLY","current":"PARTIAL","evidence":["semantic-e2e.work-candidates"],"remaining_gaps":["canonical work type catalog mapping is unresolved"]},
    {"capability_id":"project-understanding.work-dependencies","prior":"CONTRACT_ONLY","current":"PARTIAL","evidence":["semantic-e2e.source-bound-dependencies"],"remaining_gaps":["dependency graph qualification is incomplete"]},
    {"capability_id":"project-understanding.quantities","prior":"CONTRACT_ONLY","current":"PARTIAL","evidence":["semantic-e2e.quantity-review"],"remaining_gaps":["unit conversion denominator is incomplete"]},
    {"capability_id":"project-understanding.materials","prior":"CONTRACT_ONLY","current":"PARTIAL","evidence":["semantic-e2e.material-candidates"],"remaining_gaps":["material catalog resolution is incomplete"]},
    {"capability_id":"project-understanding.vor-estimate-reconciliation","prior":"CONTRACT_ONLY","current":"PARTIAL","evidence":["semantic-e2e.controlled-mismatch"],"remaining_gaps":["specialized estimate formats remain unsupported"]},
    {"capability_id":"project-understanding.project-definition","prior":"FOUNDATION_ONLY","current":"PARTIAL","evidence":["postgres.versioned-project-definition"],"remaining_gaps":["real OKS professional confirmation is absent"]},
    {"capability_id":"project-understanding.work-packages","prior":"FOUNDATION_ONLY","current":"PARTIAL","evidence":["postgres.source-bound-work-packages"],"remaining_gaps":["work type catalog remains unresolved"]},
    {"capability_id":"project-understanding.requirement-matrix","prior":"FOUNDATION_ONLY","current":"PARTIAL","evidence":["postgres.versioned-work-requirement-matrix"],"remaining_gaps":["verified normative and active rule coverage is partial"]}
  ],
  "synthetic_corpus": {
    "version": "industrial-intake-synthetic@1.0.0",
    "generator": "tools/build_industrial_intake_synthetic_corpus.py",
    "real_oks_data": false,
    "files": 13,
    "control_denominator": {"object_parts":2,"zones":2,"levels":2,"work_fronts":2,"work_types":3,"quantities":3,"materials":3,"dependencies":2,"vor_estimate_mismatches":2,"known_missing":["confirmed_geometry","material_quality_documents"]}
  },
  "effective_distribution": {"CAPABILITY_READY":16,"PARTIAL":45,"FOUNDATION_ONLY":36,"CONTRACT_ONLY":39,"NOT_IMPLEMENTED":7},
  "trial_ready": false,
  "oks_ready": false,
  "product_ready": false
}
